page_file,index,ko,translation,tone,emotion,pacing,voice,path,trans_latency,senti_latency,tts_latency
015.jpg,1,“이야기는?” 프레드릭은 목소리를 가다듬으며 잠시 동안 가만히 있었습니다.,"“What about the story?” Frederick paused for a moment, clearing his throat.",Curious and contemplative,"Reflective and intrigued, with a hint of anticipation","Deliberate, with thoughtful pauses for emphasis",shimmer,out_audio/015_sent1.mp3,1.334,2.148,1.606
015.jpg,2,그리고는 마치 무대 위에서 공연이라도 하듯 말하기 시작했습니다.,And then he began to speak as if he were performing on a stage.,Dramatic and theatrical,"Excitement and enchantment, as if unveiling a grand performance","Measured and deliberate, with pauses for effect",shimmer,out_audio/015_sent2.mp3,1.323,1.524,1.657
015.jpg,3,“눈송이는 누가 뿌릴까? 얼음은 누가 녹일까? 궂은 날씨는 누가 가져올까? 맑은 날씨는 누가 가져올까? 유월의 네 잎 클로버는 누가 피워 낼까? 날을 저물게 하는 건 누구일까? 달빛을 밝히는 건 누구일까? 하늘에 사는 들쥐 네 마리. 너희들과 나 같은 들쥐 네 마리. 봄쥐는 소나기를 몰고 온다네. 여름쥐는 온갖 꽃에 색칠을 하지. 가을쥐는 열매와 밀을 가져온다네. 겨울쥐는 오들오들 작은 몸을 웅크리지. 계절이 넷이니 얼마나 좋아? 넘치지도 모자라지도 않는 딱 사계절.”,"“Who sprinkles the snowflakes? Who melts the ice? Who brings the gloomy weather? Who brings the clear skies? Who makes the four-leaf clovers bloom in June? Who brings the twilight? Who lights up the moonlight? Four field mice living in the sky, just like you and me. The spring mouse brings the showers. The summer mouse paints every flower. The autumn mouse brings fruits and wheat. The winter mouse curls up in its tiny shivering body. There are four seasons, isn't that wonderful? Just the right amount of seasons, neither too many nor too few.”","Whimsical and poetic, with a sense of enchantment","Joyful wonder and playful curiosity, evoking the beauty of nature and seasons","Lyrical and flowing, with gentle pauses to allow the imagery to resonate",shimmer,out_audio/015_sent3.mp3,3.106,2.143,7.509
015.jpg,4,"프레드릭이 이야기를 마치자, 들쥐들은 박수를 치며 감탄을 했습니다.","As Frederick finished his story, the field mice clapped and marveled.","Joyful and celebratory, filled with delight","Elated wonder and admiration, radiating happiness","Cheerful and lively, with quick pauses for applause",shimmer,out_audio/015_sent4.mp3,1.183,1.827,1.457
015.jpg,5,"“프레드릭, 넌 시인이야!”","“Frederick, you are a poet!”",Enthusiastic and celebratory,Joyful pride and admiration,"Bright and lively, with an uplifting rhythm",shimmer,out_audio/015_sent5.mp3,0.91,1.64,1.232
