page_file,index,ko,translation,tone,emotion,pacing,voice,path,trans_latency,senti_latency,tts_latency
015.jpg,1,“이야기는?” 프레드릭은 목소리를 가다듬으며 잠시 동안 가만히 있었습니다.,"""What about the story?"" Frederick paused for a moment, clearing his throat.",Curious and thoughtful,"Contemplative, with a hint of anticipation","Slow and deliberate, with brief pauses for emphasis",shimmer,out_audio/015_sent1.mp3,1.182,1.279,1.941
015.jpg,2,그리고는 마치 무대 위에서 공연이라도 하듯 말하기 시작했습니다.,And then he began to speak as if he were performing on a stage.,Dramatic and theatrical,"Excited and lively, as if performing for an audience","Slow and deliberate, with pauses for effect",shimmer,out_audio/015_sent2.mp3,1.143,1.279,1.726
015.jpg,3,“눈송이는 누가 뿌릴까? 얼음은 누가 녹일까? 궂은 날씨는 누가 가져올까? 맑은 날씨는 누가 가져올까? 유월의 네 잎 클로버는 누가 피워 낼까? 날을 저물게 하는 건 누구일까? 달빛을 밝히는 건 누구일까? 하늘에 사는 들쥐 네 마리. 너희들과 나 같은 들쥐 네 마리. 봄쥐는 소나기를 몰고 온다네. 여름쥐는 온갖 꽃에 색칠을 하지. 가을쥐는 열매와 밀을 가져온다네. 겨울쥐는 오들오들 작은 몸을 웅크리지. 계절이 넷이니 얼마나 좋아? 넘치지도 모자라지도 않는 딱 사계절.”,"""Who scatters the snowflakes? Who melts the ice? Who brings the stormy weather? Who brings the clear skies? Who blooms the four-leaf clover in June? Who makes the day come to an end? Who brightens the moonlight? Four field mice living in the sky, just like you and me. The spring mouse brings the rain showers. The summer mouse paints all the flowers. The autumn mouse brings fruits and wheat. The winter mouse curls up its tiny body in the cold. How wonderful it is that there are four seasons? Just the right amount, neither too much nor too little, exactly four seasons.""","Playful and curious, with a hint of wonder","Cheerful and inquisitive, conveying a sense of joy and exploration about nature and the seasons","Rhythmic and slightly bouncy, with pauses for effect",shimmer,out_audio/015_sent3.mp3,3.878,1.765,8.409
015.jpg,4,"프레드릭이 이야기를 마치자, 들쥐들은 박수를 치며 감탄을 했습니다.","As Frederick finished his story, the mice applauded and were amazed.",Joyful and celebratory,Excited and delighted,"Moderate, with an uplifting cadence",shimmer,out_audio/015_sent4.mp3,1.174,1.174,2.023
015.jpg,5,"“프레드릭, 넌 시인이야!”","""Frederick, you are a poet!""",Excited and encouraging,Joyful and proud,Quick and lively with a playful rhythm,shimmer,out_audio/015_sent5.mp3,1.213,1.174,1.072
