page_file,index,ko,translation,tone,emotion,pacing,voice,path,trans_latency,senti_latency,tts_latency
014_para1.txt,1,"""이야기는?"" 프레드릭은 목소리를 가다듬으며 잠시 동안 가만히 있었습니다.","""What about the story?"" Frederick paused for a moment, clearing his throat.",Curious and contemplative,Thoughtful and slightly anxious,"Slow and deliberate, with pauses for reflection",shimmer,out_audio/014/014_para1_sent1.mp3,1.08,1.011,1.559
014_para1.txt,2,그리고는 마치 무대 위에서 공연이라도 하듯 말하기 시작했습니다.,And then he began to speak as if he were performing on stage.,"Dramatic and engaging, as if performing for an audience.","Excited and theatrical, conveying a sense of wonder and imagination.","Slow and deliberate, with pauses to emphasize key moments, building anticipation.",shimmer,out_audio/014/014_para1_sent2.mp3,0.89,1.618,1.776
014_para1.txt,3,"""눈송이는 누가 뿌릴까? 얼음은 누가 녹일까? 궂은 · 날씨는 누가 가져올까? 맑은 날씨는 누가 가져올까? 유월의 네 잎 클로버는 누가 피워 낼까? 날을 저물게 하는 건 누구일까? 달빛을 밝히는 건 누구일까? 하늘에 사는 들쥐 네 마리. 너희들과 나 같은 들쥐 네 마리. 봄쥐는 소나기를 몰고 온다네. 여름쥐는 온갖 꽃에 색칠을 하지. 가을쥐는 열매와 밀을 가져온다네. 겨울쥐는 오들오들 작은 몸을 웅크리지. 계절이 넷이니 얼마나 좋아? 넘치지도 모자라지도 않는 딱 사계절."" 프레드릭이 이야기를 마치자.","""Who scatters the snowflakes? Who melts the ice? Who brings the stormy weather? Who brings the clear skies? Who makes the four-leaf clover bloom in June? Who makes the day come to an end? Who brightens the moonlight? Four mice living in the sky—just like you and me. The spring mouse brings the rain showers. The summer mouse colors all the flowers. The autumn mouse brings the fruits and wheat. The winter mouse curls up with its little shivering body. How wonderful it is to have four seasons! Just the right amount, neither too much nor too little, exactly four seasons."" As Frederick finished his story,",Wondering and playful,Curiously joyful and whimsical,"Lively and rhythmic, with rising inflections on questions",shimmer,out_audio/014/014_para1_sent3.mp3,3.2,1.158,8.009
014_para1.txt,4,들쥐들은 박수를 치며 감탄을 했습니다.,The field mice clapped and marveled.,Excited and joyful,Delightfully amazed and cheerful,"Quick and rhythmic, with lively pauses for emphasis",shimmer,out_audio/014/014_para1_sent4.mp3,1.079,1.135,0.989
014_para1.txt,5,"""프레드릭, 넌 시인이야!""","""Frederick, you are a poet!""",Excited and encouraging,Joyfully proud and enthusiastic,"Quick and lively, with an uplifting rhythm",shimmer,out_audio/014/014_para1_sent5.mp3,1.122,1.01,0.95
